{
  "schema_version": "1.0.0",
  "project": "ChangeBridge",
  "authority": "COMPLETION_CONTRACT.md",
  "status_values": ["SATISFIED", "PARTIAL", "UNSATISFIED", "DEFERRED", "BLOCKED"],
  "requirements": [
    {
      "id": "CB-BOUNDARY-001",
      "title": "Single snapshot frontier",
      "normative": "MUST",
      "statement": "ChangeBridge MUST bind each migration generation to exactly one immutable source snapshot frontier S.",
      "rationale": "CDC coverage cannot be proven when the snapshot boundary is implicit or mutable.",
      "scope": "generation",
      "source_conditions": [1],
      "source_invariants": ["boundary"],
      "dependencies": [],
      "current_status": "PARTIAL",
      "owner_stage": "part1-stage3",
      "verification_method": "contract tests plus integration evidence that binds source snapshot metadata to one generation",
      "minimum_evidence": "LOCAL_VERIFIED",
      "implementation_paths": ["src/changebridge/engine.py", "src/changebridge/source_boundary.py", "scripts/stage21_postgres_adapter.py"],
      "proof_paths": ["tests/test_engine.py", "tests/test_source_boundary.py", "tests/integration/test_postgres_source_boundary.py", "evidence/part2/stage1/boundary-capture-report.json"],
      "failure_condition": "A generation has no frontier, more than one frontier, or a frontier that can change after snapshot sealing.",
      "limitations": "Satisfied for the isolated PostgreSQL exported-snapshot path. AWS DMS checkpoint mapping and managed-source proof remain unverified.",
      "review_notes": "Stage 2.1 binds each local generation to one immutable consistent point and rejects a second frontier."
    },
    {
      "id": "CB-BOUNDARY-002",
      "title": "Half-open CDC coverage",
      "normative": "MUST",
      "statement": "ChangeBridge MUST define generation coverage as the snapshot at S followed by CDC events in the half-open interval (S, F].",
      "rationale": "An explicit interval prevents duplicate application at S and omissions after S.",
      "scope": "generation",
      "source_conditions": [1],
      "source_invariants": ["boundary", "continuity"],
      "dependencies": ["CB-BOUNDARY-001"],
      "current_status": "PARTIAL",
      "owner_stage": "part1-stage3",
      "verification_method": "boundary model and integration tests for first and last included source positions",
      "minimum_evidence": "LOCAL_VERIFIED",
      "implementation_paths": ["src/changebridge/model.py", "src/changebridge/engine.py", "src/changebridge/source_boundary.py", "scripts/stage21_postgres_adapter.py"],
      "proof_paths": ["tests/test_engine.py", "tests/test_source_boundary.py", "tests/integration/test_postgres_source_boundary.py", "evidence/part2/stage1/boundary-capture-report.json", "evidence/part2/stage1/negative-case-report.json"],
      "failure_condition": "The first CDC event overlaps S, a source position after S is omitted, or an event beyond F is included in proof at F.",
      "limitations": "Satisfied for local PostgreSQL transaction commit LSNs. DMS checkpoint semantics, transport delivery, and terminal target frontier F remain later-stage proof.",
      "review_notes": "The exported snapshot is S; the first governed decoded transaction uses its COMMIT LSN and must be strictly greater than S."
    },
    {
      "id": "CB-BOUNDARY-003",
      "title": "Frontier lineage",
      "normative": "MUST",
      "statement": "ChangeBridge MUST retain source identity, engine/version, snapshot checkpoint, terminal frontier F, and generation identity in the proof lineage.",
      "rationale": "A frontier without source and generation lineage cannot prove completeness.",
      "scope": "evidence",
      "source_conditions": [1, 11],
      "source_invariants": ["boundary", "evidence_binding"],
      "dependencies": ["CB-BOUNDARY-001", "CB-BOUNDARY-002"],
      "current_status": "PARTIAL",
      "owner_stage": "part3-managed-proof",
      "verification_method": "managed evidence schema validation and exact-run reconciliation",
      "minimum_evidence": "AWS_VERIFIED",
      "implementation_paths": ["src/changebridge/source_boundary.py", "contracts/source-boundary-receipt-v1.json", "future:src/changebridge/evidence/frontier.py"],
      "proof_paths": ["evidence/part2/stage1/boundary-capture-report.json", "future:evidence/managed/frontier-lineage.json"],
      "failure_condition": "The proof cannot uniquely identify the source, generation, S, F, or producing run.",
      "limitations": "Local lineage now binds source, server/image, generation, workload, schema, snapshot, S and producing run; managed terminal F and AWS run lineage remain absent.",
      "review_notes": "Stage 2.1 supplies local source-boundary lineage only, so the managed requirement remains partial."
    },
    {
      "id": "CB-ORDER-001",
      "title": "Complete normalized event envelope",
      "normative": "MUST",
      "statement": "Each normalized CDC event MUST preserve source position, transaction identity, order, operation, primary key, before image, after image, schema version, and deterministic replay identity.",
      "rationale": "Loss of source semantics makes correct ordering, conflict detection, delete handling, and replay impossible.",
      "scope": "event",
      "source_conditions": [2],
      "source_invariants": ["order", "replay_determinism", "delete_correctness"],
      "dependencies": ["CB-BOUNDARY-002"],
      "current_status": "PARTIAL",
      "owner_stage": "part1-stage4",
      "verification_method": "versioned schema validation plus round-trip and property tests",
      "minimum_evidence": "LOCAL_VERIFIED",
      "implementation_paths": ["src/changebridge/model.py", "contracts/cdc-envelope-v1.schema.json", "src/changebridge/contracts.py", "src/changebridge/normalizer.py"],
      "proof_paths": ["tests/test_contract_oracle_authority.py", "tests/fixtures/contract-oracle-authority/valid-cdc-event.json", "tests/test_part2_stage2_normalizer.py", "evidence/part2/stage2/normalization-report.json"],
      "failure_condition": "Any required source semantic is absent, ambiguous, lossy, or excluded from replay identity.",
      "limitations": "The v1 envelope and one explicit synthetic local profile now have runtime conformance proof. AWS DMS emission and managed transport remain unverified.",
      "review_notes": "Part 2 Stage 2 adds local manifest-normalizer conformance without promoting a managed-service claim."
    },
    {
      "id": "CB-ORDER-002",
      "title": "Contiguous batch chain",
      "normative": "MUST",
      "statement": "Applied CDC batches MUST form a contiguous chain from the stored generation frontier to the declared batch end frontier.",
      "rationale": "A successful transport can still omit or overlap source intervals.",
      "scope": "batch",
      "source_conditions": [2, 5],
      "source_invariants": ["continuity"],
      "dependencies": ["CB-BOUNDARY-002"],
      "current_status": "SATISFIED",
      "owner_stage": "part2-runtime",
      "verification_method": "state-model tests for contiguous, gap, overlap, duplicate, and restart paths",
      "minimum_evidence": "LOCAL_VERIFIED",
      "implementation_paths": ["src/changebridge/engine.py"],
      "proof_paths": ["tests/test_engine.py", "evidence/local-simulation.json"],
      "failure_condition": "A batch starts anywhere other than the committed frontier or advances to a non-increasing end frontier.",
      "limitations": "Satisfied only for the local SQLite oracle, not managed transport.",
      "review_notes": "Managed proof remains separately required by CB-OPS-003."
    },
    {
      "id": "CB-ORDER-003",
      "title": "Deterministic transaction order",
      "normative": "MUST",
      "statement": "Transactions and events MUST be applied in a deterministic order consistent with committed source order.",
      "rationale": "Non-deterministic order changes target state for conflicting mutations.",
      "scope": "transaction",
      "source_conditions": [2, 3, 10],
      "source_invariants": ["order", "replay_determinism"],
      "dependencies": ["CB-ORDER-001", "CB-ORDER-002"],
      "current_status": "PARTIAL",
      "owner_stage": "part1-stage4",
      "verification_method": "ordering oracle, permutation property tests, and managed transaction-order evidence",
      "minimum_evidence": "LOCAL_VERIFIED",
      "implementation_paths": ["src/changebridge/engine.py", "src/changebridge/contracts.py", "src/changebridge/source_workload.py", "src/changebridge/normalizer.py"],
      "proof_paths": ["tests/test_contract_oracle_authority.py", "tests/test_source_workload.py", "tests/test_part2_stage2_normalizer.py", "evidence/part2/stage1/source-history-ledger.json", "evidence/part2/stage1/determinism-report.json", "evidence/part2/stage2/determinism-report.json"],
      "failure_condition": "Equivalent immutable inputs can produce different event order or target state.",
      "limitations": "Typed source order and local envelope ordering are verified for the explicit synthetic profile; AWS DMS delivery and target-apply conformance remain unverified.",
      "review_notes": "Part 2 Stage 2 proves numeric LSN and source-sequence ordering independent of arrival and time."
    },
    {
      "id": "CB-ORDER-004",
      "title": "Transaction boundary preservation",
      "normative": "MUST",
      "statement": "ChangeBridge MUST preserve source transaction boundaries through normalized ingestion and target application.",
      "rationale": "Partial transaction application violates source semantics and invalidates checkpoint safety.",
      "scope": "transaction",
      "source_conditions": [2, 3],
      "source_invariants": ["order", "failure_atomicity"],
      "dependencies": ["CB-ORDER-001", "CB-ORDER-003"],
      "current_status": "PARTIAL",
      "owner_stage": "part2-runtime",
      "verification_method": "multi-event transaction tests and failure injection at each apply boundary",